root@lamp-ubuntu-s-1vcpu-1gb-tor1-01:~# tcpdump -i eth0 port 22
18:13:19.323294 IP 178.128.235.233.ssh > cpe688f2e17b093-cm688f2e17b090.cpe.net.cable.rogers.com.55367: Flags [P.], seq 1420100:1424232, ack 865, win 501, length 4132
18:13:19.323354 IP 178.128.235.233.ssh > cpe688f2e17b093-cm688f2e17b090.cpe.net.cable.rogers.com.55367: Flags [P.], seq 1424232:1424484, ack 865, win 501, length 252
18:13:19.323451 IP 178.128.235.233.ssh > cpe688f2e17b093-cm688f2e17b090.cpe.net.cable.rogers.com.55367: Flags [P.], seq 1424484:1424856, ack 865, win 501, length 372
18:13:19.323568 IP 178.128.235.233.ssh > cpe688f2e17b093-cm688f2e17b090.cpe.net.cable.rogers.com.55367: Flags [P.], seq 1424856:1425060, ack 865, win 501, length 204
18:13:19.323722 IP 178.128.235.233.ssh > cpe688f2e17b093-cm688f2e17b090.cpe.net.cable.rogers.com.55367: Flags [P.], seq 1425060:1425264, ack 865, win 501, length 204
18:13:19.323881 IP 178.128.235.233.ssh > cpe688f2e17b093-cm688f2e17b090.cpe.net.cable.rogers.com.55367: Flags [P.], seq 1425264:1425468, ack 865, win 501, length 204
18:13:19.324026 IP 178.128.235.233.ssh > cpe688f2e17b093-cm688f2e17b090.cpe.net.cable.rogers.com.55367: Flags [P.], seq 1425468:1425672, ack 865, win 501, length 204
18:13:19.324193 IP 178.128.235.233.ssh > cpe688f2e17b093-cm688f2e17b090.cpe.net.cable.rogers.com.55367: Flags [P.], seq 1425672:1425876, ack 865, win 501, length 204
18:13:19.324348 IP 178.128.235.233.ssh > cpe688f2e17b093-cm688f2e17b090.cpe.net.cable.rogers.com.55367: Flags [P.], seq 1425876:1426080, ack 865, win 501, length 204
18:13:19.324485 IP 178.128.235.233.ssh > cpe688f2e17b093-cm688f2e17b090.cpe.net.cable.rogers.com.55367: Flags [P.], seq 1426080:1426284, ack 865, win 501, length 204
18:13:19.324583 IP 178.128.235.233.ssh > cpe688f2e17b093-cm688f2e17b090.cpe.net.cable.rogers.com.55367: Flags [P.], seq 1426284:1426488, ack 865, win 501, length 204
18:13:19.324670 IP 178.128.235.233.ssh > cpe688f2e17b093-cm688f2e17b090.cpe.net.cable.rogers.com.55367: Flags [P.], seq 1426488:1426692, ack 865, win 501, length 204
18:13:19.324755 IP 178.128.235.233.ssh > cpe688f2e17b093-cm688f2e17b090.cpe.net.cable.rogers.com.55367: Flags [P.], seq 1426692:1426896, ack 865, win 501, length 204
18:13:19.324848 IP 178.128.235.233.ssh > cpe688f2e17b093-cm688f2e17b090.cpe.net.cable.rogers.com.55367: Flags [P.], seq 1426896:1427100, ack 865, win 501, length 204
18:13:19.324934 IP 178.128.235.233.ssh > cpe688f2e17b093-cm688f2e17b090.cpe.net.cable.rogers.com.55367: Flags [P.], seq 1427100:1427304, ack 865, win 501, length 204
18:13:19.325037 IP 178.128.235.233.ssh > cpe688f2e17b093-cm688f2e17b090.cpe.net.cable.rogers.com.55367: Flags [P.], seq 1427304:1427508, ack 865, win 501, length 204
18:13:19.325129 IP 178.128.235.233.ssh > cpe688f2e17b093-cm688f2e17b090.cpe.net.cable.rogers.com.55367: Flags [P.], seq 1427508:1427712, ack 865, win 501, length 204
18:13:19.325214 IP 178.128.235.233.ssh > cpe688f2e17b093-cm688f2e17b090.cpe.net.cable.rogers.com.55367: Flags [P.], seq 1427712:1427916, ack 865, win 501, length 204
18:13:19.325347 IP 178.128.235.233.ssh > cpe688f2e17b093-cm688f2e17b090.cpe.net.cable.rogers.com.55367: Flags [P.], seq 1427916:1428120, ack 865, win 501, length 204
18:13:19.325481 IP 178.128.235.233.ssh > cpe688f2e17b093-cm688f2e17b090.cpe.net.cable.rogers.com.55367: Flags [P.], seq 1428120:1428324, ack 865, win 501, length 204
18:13:19.325583 IP 178.128.235.233.ssh > cpe688f2e17b093-cm688f2e17b090.cpe.net.cable.rogers.com.55367: Flags [P.], seq 1428324:1428528, ack 865, win 501, length 204
18:13:19.325672 IP 178.128.235.233.ssh > cpe688f2e17b093-cm688f2e17b090.cpe.net.cable.rogers.com.55367: Flags [P.], seq 1428528:1428732, ack 865, win 501, length 204
18:13:19.325779 IP 178.128.235.233.ssh > cpe688f2e17b093-cm688f2e17b090.cpe.net.cable.rogers.com.55367: Flags [P.], seq 1428732:1428936, ack 865, win 501, length 204
18:13:19.325888 IP 178.128.235.233.ssh > cpe688f2e17b093-cm688f2e17b090.cpe.net.cable.rogers.com.55367: Flags [P.], seq 1428936:1429140, ack 865, win 501, length 204
18:13:19.326028 IP 178.128.235.233.ssh > cpe688f2e17b093-cm688f2e17b090.cpe.net.cable.rogers.com.55367: Flags [P.], seq 1429140:1429344, ack 865, win 501, length 204
18:13:19.326125 IP 178.128.235.233.ssh > cpe688f2e17b093-cm688f2e17b090.cpe.net.cable.rogers.com.55367: Flags [P.], seq 1429344:1429548, ack 865, win 501, length 204
18:13:19.326216 IP 178.128.235.233.ssh > cpe688f2e17b093-cm688f2e17b090.cpe.net.cable.rogers.com.55367: Flags [P.], seq 1429548:1429752, ack 865, win 501, length 204
18:13:19.326306 IP 178.128.235.233.ssh > cpe688f2e17b093-cm688f2e17b090.cpe.net.cable.rogers.com.55367: Flags [P.], seq 1429752:1429956, ack 865, win 501, length 204
18:13:19.326390 IP 178.128.235.233.ssh > cpe688f2e17b093-cm688f2e17b090.cpe.net.cable.rogers.com.55367: Flags [P.], seq 1429956:1430160, ack 865, win 501, length 204
18:13:19.326475 IP 178.128.235.233.ssh > cpe688f2e17b093-cm688f2e17b090.cpe.net.cable.rogers.com.55367: Flags [P.], seq 1430160:1430364, ack 865, win 501, length 204
18:13:19.326618 IP 178.128.235.233.ssh > cpe688f2e17b093-cm688f2e17b090.cpe.net.cable.rogers.com.55367: Flags [P.], seq 1430364:1430568, ack 865, win 501, length 204
18:13:19.326734 IP 178.128.235.233.ssh > cpe688f2e17b093-cm688f2e17b090.cpe.net.cable.rogers.com.55367: Flags [P.], seq 1430568:1430772, ack 865, win 501, length 204
18:13:19.326838 IP 178.128.235.233.ssh > cpe688f2e17b093-cm688f2e17b090.cpe.net.cable.rogers.com.55367: Flags [P.], seq 1430772:1430976, ack 865, win 501, length 204
18:13:19.326935 IP 178.128.235.233.ssh > cpe688f2e17b093-cm688f2e17b090.cpe.net.cable.rogers.com.55367: Flags [P.], seq 1430976:1431180, ack 865, win 501, length 204
18:13:19.327021 IP 178.128.235.233.ssh > cpe688f2e17b093-cm688f2e17b090.cpe.net.cable.rogers.com.55367: Flags [P.], seq 1431180:1431384, ack 865, win 501, length 204
18:13:19.327106 IP 178.128.235.233.ssh > cpe688f2e17b093-cm688f2e17b090.cpe.net.cable.rogers.com.55367: Flags [P.], seq 1431384:1431588, ack 865, win 501, length 204
18:13:19.327198 IP 178.128.235.233.ssh > cpe688f2e17b093-cm688f2e17b090.cpe.net.cable.rogers.com.55367: Flags [P.], seq 1431588:1431792, ack 865, win 501, length 204
18:13:19.327285 IP 178.128.235.233.ssh > cpe688f2e17b093-cm688f2e17b090.cpe.net.cable.rogers.com.55367: Flags [P.], seq 1431792:1431996, ack 865, win 501, length 204
18:13:19.327376 IP 178.128.235.233.ssh > cpe688f2e17b093-cm688f2e17b090.cpe.net.cable.rogers.com.55367: Flags [P.], seq 1431996:1432200, ack 865, win 501, length 204
18:13:19.327465 IP 178.128.235.233.ssh > cpe688f2e17b093-cm688f2e17b090.cpe.net.cable.rogers.com.55367: Flags [P.], seq 1432200:1432404, ack 865, win 501, length 204
18:13:19.327582 IP 178.128.235.233.ssh > cpe688f2e17b093-cm688f2e17b090.cpe.net.cable.rogers.com.55367: Flags [P.], seq 1432404:1432608, ack 865, win 501, length 204
18:13:19.327692 IP 178.128.235.233.ssh > cpe688f2e17b093-cm688f2e17b090.cpe.net.cable.rogers.com.55367: Flags [P.], seq 1432608:1432812, ack 865, win 501, length 204
18:13:19.327786 IP 178.128.235.233.ssh > cpe688f2e17b093-cm688f2e17b090.cpe.net.cable.rogers.com.55367: Flags [P.], seq 1432812:1433016, ack 865, win 501, length 204
18:13:19.327875 IP 178.128.235.233.ssh > cpe688f2e17b093-cm688f2e17b090.cpe.net.cable.rogers.com.55367: Flags [P.], seq 1433016:1433220, ack 865, win 501, length 204
18:13:19.327989 IP 178.128.235.233.ssh > cpe688f2e17b093-cm688f2e17b090.cpe.net.cable.rogers.com.55367: Flags [P.], seq 1433220:1433424, ack 865, win 501, length 204
18:13:19.328079 IP 178.128.235.233.ssh > cpe688f2e17b093-cm688f2e17b090.cpe.net.cable.rogers.com.55367: Flags [P.], seq 1433424:1433628, ack 865, win 501, length 204
18:13:19.328166 IP 178.128.235.233.ssh > cpe688f2e17b093-cm688f2e17b090.cpe.net.cable.rogers.com.55367: Flags [P.], seq 1433628:1433832, ack 865, win 501, length 204
18:13:19.328254 IP 178.128.235.233.ssh > cpe688f2e17b093-cm688f2e17b090.cpe.net.cable.rogers.com.55367: Flags [P.], seq 1433832:1434036, ack 865, win 501, length 204
18:13:19.328338 IP 178.128.235.233.ssh > cpe688f2e17b093-cm688f2e17b090.cpe.net.cable.rogers.com.55367: Flags [P.], seq 1434036:1434240, ack 865, win 501, length 204
18:13:19.328381 IP cpe688f2e17b093-cm688f2e17b090.cpe.net.cable.rogers.com.55367 > 178.128.235.233.ssh: Flags [.], ack 1401596, win 1029, length 0
18:13:19.328395 IP cpe688f2e17b093-cm688f2e17b090.cpe.net.cable.rogers.com.55367 > 178.128.235.233.ssh: Flags [.], ack 1402208, win 1026, length 0
18:13:19.328400 IP cpe688f2e17b093-cm688f2e17b090.cpe.net.cable.rogers.com.55367 > 178.128.235.233.ssh: Flags [.], ack 1403228, win 1029, length 0
18:13:19.328407 IP cpe688f2e17b093-cm688f2e17b090.cpe.net.cable.rogers.com.55367 > 178.128.235.233.ssh: Flags [.], ack 1403636, win 1027, length 0
18:13:19.328411 IP cpe688f2e17b093-cm688f2e17b090.cpe.net.cable.rogers.com.55367 > 178.128.235.233.ssh: Flags [.], ack 1404044, win 1025, length 0
18:13:19.328416 IP cpe688f2e17b093-cm688f2e17b090.cpe.net.cable.rogers.com.55367 > 178.128.235.233.ssh: Flags [.], ack 1404860, win 1029, length 0
18:13:19.328421 IP cpe688f2e17b093-cm688f2e17b090.cpe.net.cable.rogers.com.55367 > 178.128.235.233.ssh: Flags [.], ack 1405472, win 1026, length 0
18:13:19.328426 IP cpe688f2e17b093-cm688f2e17b090.cpe.net.cable.rogers.com.55367 > 178.128.235.233.ssh: Flags [.], ack 1405880, win 1025, length 0
18:13:19.328430 IP cpe688f2e17b093-cm688f2e17b090.cpe.net.cable.rogers.com.55367 > 178.128.235.233.ssh: Flags [.], ack 1406696, win 1029, length 0
18:13:19.328438 IP cpe688f2e17b093-cm688f2e17b090.cpe.net.cable.rogers.com.55367 > 178.128.235.233.ssh: Flags [.], ack 1407308, win 1026, length 0
18:13:19.328442 IP cpe688f2e17b093-cm688f2e17b090.cpe.net.cable.rogers.com.55367 > 178.128.235.233.ssh: Flags [.], ack 1410308, win 1029, length 0
18:13:19.328450 IP cpe688f2e17b093-cm688f2e17b090.cpe.net.cable.rogers.com.55367 > 178.128.235.233.ssh: Flags [.], ack 1411940, win 1029, length 0
18:13:19.328457 IP cpe688f2e17b093-cm688f2e17b090.cpe.net.cable.rogers.com.55367 > 178.128.235.233.ssh: Flags [.], ack 1412348, win 1027, length 0
18:13:19.328462 IP cpe688f2e17b093-cm688f2e17b090.cpe.net.cable.rogers.com.55367 > 178.128.235.233.ssh: Flags [.], ack 1413164, win 1024, length 0
18:13:19.328468 IP cpe688f2e17b093-cm688f2e17b090.cpe.net.cable.rogers.com.55367 > 178.128.235.233.ssh: Flags [.], ack 1413368, win 1029, length 0
18:13:19.328471 IP cpe688f2e17b093-cm688f2e17b090.cpe.net.cable.rogers.com.55367 > 178.128.235.233.ssh: Flags [.], ack 1413980, win 1026, length 0
18:13:19.328475 IP cpe688f2e17b093-cm688f2e17b090.cpe.net.cable.rogers.com.55367 > 178.128.235.233.ssh: Flags [.], ack 1414388, win 1025, length 0
18:13:19.328479 IP cpe688f2e17b093-cm688f2e17b090.cpe.net.cable.rogers.com.55367 > 178.128.235.233.ssh: Flags [.], ack 1414796, win 1029, length 0
18:13:19.328483 IP cpe688f2e17b093-cm688f2e17b090.cpe.net.cable.rogers.com.55367 > 178.128.235.233.ssh: Flags [.], ack 1415204, win 1027, length 0
18:13:19.328487 IP cpe688f2e17b093-cm688f2e17b090.cpe.net.cable.rogers.com.55367 > 178.128.235.233.ssh: Flags [.], ack 1415408, win 1026, length 0
18:13:19.328776 IP 178.128.235.233.ssh > cpe688f2e17b093-cm688f2e17b090.cpe.net.cable.rogers.com.55367: Flags [P.], seq 1434240:1437404, ack 865, win 501, length 3164
18:13:19.328875 IP 178.128.235.233.ssh > cpe688f2e17b093-cm688f2e17b090.cpe.net.cable.rogers.com.55367: Flags [P.], seq 1437404:1437608, ack 865, win 501, length 204
18:13:19.328966 IP 178.128.235.233.ssh > cpe688f2e17b093-cm688f2e17b090.cpe.net.cable.rogers.com.55367: Flags [P.], seq 1437608:1437812, ack 865, win 501, length 204
18:13:19.329097 IP 178.128.235.233.ssh > cpe688f2e17b093-cm688f2e17b090.cpe.net.cable.rogers.com.55367: Flags [P.], seq 1437812:1438016, ack 865, win 501, length 204
18:13:19.329211 IP 178.128.235.233.ssh > cpe688f2e17b093-cm688f2e17b090.cpe.net.cable.rogers.com.55367: Flags [P.], seq 1438016:1438220, ack 865, win 501, length 204
18:13:19.329305 IP 178.128.235.233.ssh > cpe688f2e17b093-cm688f2e17b090.cpe.net.cable.rogers.com.55367: Flags [P.], seq 1438220:1438424, ack 865, win 501, length 204
18:13:19.329397 IP 178.128.235.233.ssh > cpe688f2e17b093-cm688f2e17b090.cpe.net.cable.rogers.com.55367: Flags [P.], seq 1438424:1438628, ack 865, win 501, length 204
18:13:19.329516 IP 178.128.235.233.ssh > cpe688f2e17b093-cm688f2e17b090.cpe.net.cable.rogers.com.55367: Flags [P.], seq 1438628:1438832, ack 865, win 501, length 204
18:13:19.329617 IP 178.128.235.233.ssh > cpe688f2e17b093-cm688f2e17b090.cpe.net.cable.rogers.com.55367: Flags [P.], seq 1438832:1439036, ack 865, win 501, length 204
18:13:19.329712 IP 178.128.235.233.ssh > cpe688f2e17b093-cm688f2e17b090.cpe.net.cable.rogers.com.55367: Flags [P.], seq 1439036:1439240, ack 865, win 501, length 204
18:13:19.329813 IP 178.128.235.233.ssh > cpe688f2e17b093-cm688f2e17b090.cpe.net.cable.rogers.com.55367: Flags [P.], seq 1439240:1439444, ack 865, win 501, length 204
18:13:19.329955 IP 178.128.235.233.ssh > cpe688f2e17b093-cm688f2e17b090.cpe.net.cable.rogers.com.55367: Flags [P.], seq 1439444:1439648, ack 865, win 501, length 204
18:13:19.330105 IP 178.128.235.233.ssh > cpe688f2e17b093-cm688f2e17b090.cpe.net.cable.rogers.com.55367: Flags [P.], seq 1439648:1439852, ack 865, win 501, length 204
18:13:19.330239 IP 178.128.235.233.ssh > cpe688f2e17b093-cm688f2e17b090.cpe.net.cable.rogers.com.55367: Flags [P.], seq 1439852:1440056, ack 865, win 501, length 204
18:13:19.330368 IP 178.128.235.233.ssh > cpe688f2e17b093-cm688f2e17b090.cpe.net.cable.rogers.com.55367: Flags [P.], seq 1440056:1440260, ack 865, win 501, length 204
18:13:19.330500 IP 178.128.235.233.ssh > cpe688f2e17b093-cm688f2e17b090.cpe.net.cable.rogers.com.55367: Flags [P.], seq 1440260:1440464, ack 865, win 501, length 204
18:13:19.330640 IP 178.128.235.233.ssh > cpe688f2e17b093-cm688f2e17b090.cpe.net.cable.rogers.com.55367: Flags [P.], seq 1440464:1440668, ack 865, win 501, length 204
18:13:19.330753 IP 178.128.235.233.ssh > cpe688f2e17b093-cm688f2e17b090.cpe.net.cable.rogers.com.55367: Flags [P.], seq 1440668:1440872, ack 865, win 501, length 204
18:13:19.330885 IP 178.128.235.233.ssh > cpe688f2e17b093-cm688f2e17b090.cpe.net.cable.rogers.com.55367: Flags [P.], seq 1440872:1441076, ack 865, win 501, length 204
18:13:19.331022 IP 178.128.235.233.ssh > cpe688f2e17b093-cm688f2e17b090.cpe.net.cable.rogers.com.55367: Flags [P.], seq 1441076:1441280, ack 865, win 501, length 204
18:13:19.331124 IP 178.128.235.233.ssh > cpe688f2e17b093-cm688f2e17b090.cpe.net.cable.rogers.com.55367: Flags [P.], seq 1441280:1441484, ack 865, win 501, length 204
18:13:19.331249 IP 178.128.235.233.ssh > cpe688f2e17b093-cm688f2e17b090.cpe.net.cable.rogers.com.55367: Flags [P.], seq 1441484:1441688, ack 865, win 501, length 204
18:13:19.331387 IP 178.128.235.233.ssh > cpe688f2e17b093-cm688f2e17b090.cpe.net.cable.rogers.com.55367: Flags [P.], seq 1441688:1441892, ack 865, win 501, length 204
18:13:19.331511 IP 178.128.235.233.ssh > cpe688f2e17b093-cm688f2e17b090.cpe.net.cable.rogers.com.55367: Flags [P.], seq 1441892:1442096, ack 865, win 501, length 204
18:13:19.331602 IP 178.128.235.233.ssh > cpe688f2e17b093-cm688f2e17b090.cpe.net.cable.rogers.com.55367: Flags [P.], seq 1442096:1442300, ack 865, win 501, length 204
18:13:19.331690 IP 178.128.235.233.ssh > cpe688f2e17b093-cm688f2e17b090.cpe.net.cable.rogers.com.55367: Flags [P.], seq 1442300:1442504, ack 865, win 501, length 204
18:13:19.331780 IP 178.128.235.233.ssh > cpe688f2e17b093-cm688f2e17b090.cpe.net.cable.rogers.com.55367: Flags [P.], seq 1442504:1442708, ack 865, win 501, length 204
18:13:19.331868 IP 178.128.235.233.ssh > cpe688f2e17b093-cm688f2e17b090.cpe.net.cable.rogers.com.55367: Flags [P.], seq 1442708:1442912, ack 865, win 501, length 204
18:13:19.331977 IP 178.128.235.233.ssh > cpe688f2e17b093-cm688f2e17b090.cpe.net.cable.rogers.com.55367: Flags [P.], seq 1442912:1443116, ack 865, win 501, length 204
18:13:19.332100 IP 178.128.235.233.ssh > cpe688f2e17b093-cm688f2e17b090.cpe.net.cable.rogers.com.55367: Flags [P.], seq 1443116:1443320, ack 865, win 501, length 204
18:13:19.332188 IP 178.128.235.233.ssh > cpe688f2e17b093-cm688f2e17b090.cpe.net.cable.rogers.com.55367: Flags [P.], seq 1443320:1443524, ack 865, win 501, length 204
18:13:19.332274 IP 178.128.235.233.ssh > cpe688f2e17b093-cm688f2e17b090.cpe.net.cable.rogers.com.55367: Flags [P.], seq 1443524:1443728, ack 865, win 501, length 204
18:13:19.332370 IP 178.128.235.233.ssh > cpe688f2e17b093-cm688f2e17b090.cpe.net.cable.rogers.com.55367: Flags [P.], seq 1443728:1443932, ack 865, win 501, length 204
18:13:19.332457 IP 178.128.235.233.ssh > cpe688f2e17b093-cm688f2e17b090.cpe.net.cable.rogers.com.55367: Flags [P.], seq 1443932:1444136, ack 865, win 501, length 204
18:13:19.332542 IP 178.128.235.233.ssh > cpe688f2e17b093-cm688f2e17b090.cpe.net.cable.rogers.com.55367: Flags [P.], seq 1444136:1444340, ack 865, win 501, length 204
18:13:19.332632 IP 178.128.235.233.ssh > cpe688f2e17b093-cm688f2e17b090.cpe.net.cable.rogers.com.55367: Flags [P.], seq 1444340:1444544, ack 865, win 501, length 204
18:13:19.332762 IP 178.128.235.233.ssh > cpe688f2e17b093-cm688f2e17b090.cpe.net.cable.rogers.com.55367: Flags [P.], seq 1444544:1444748, ack 865, win 501, length 204
18:13:19.332865 IP 178.128.235.233.ssh > cpe688f2e17b093-cm688f2e17b090.cpe.net.cable.rogers.com.55367: Flags [P.], seq 1444748:1444952, ack 865, win 501, length 204
18:13:19.332952 IP 178.128.235.233.ssh > cpe688f2e17b093-cm688f2e17b090.cpe.net.cable.rogers.com.55367: Flags [P.], seq 1444952:1445156, ack 865, win 501, length 204
18:13:19.333044 IP 178.128.235.233.ssh > cpe688f2e17b093-cm688f2e17b090.cpe.net.cable.rogers.com.55367: Flags [P.], seq 1445156:1445360, ack 865, win 501, length 204
18:13:19.333189 IP 178.128.235.233.ssh > cpe688f2e17b093-cm688f2e17b090.cpe.net.cable.rogers.com.55367: Flags [P.], seq 1445360:1445564, ack 865, win 501, length 204
18:13:19.333296 IP 178.128.235.233.ssh > cpe688f2e17b093-cm688f2e17b090.cpe.net.cable.rogers.com.55367: Flags [P.], seq 1445564:1445768, ack 865, win 501, length 204
18:13:19.333382 IP 178.128.235.233.ssh > cpe688f2e17b093-cm688f2e17b090.cpe.net.cable.rogers.com.55367: Flags [P.], seq 1445768:1445972, ack 865, win 501, length 204
18:13:19.333486 IP 178.128.235.233.ssh > cpe688f2e17b093-cm688f2e17b090.cpe.net.cable.rogers.com.55367: Flags [P.], seq 1445972:1446176, ack 865, win 501, length 204
18:13:19.333582 IP 178.128.235.233.ssh > cpe688f2e17b093-cm688f2e17b090.cpe.net.cable.rogers.com.55367: Flags [P.], seq 1446176:1446380, ack 865, win 501, length 204
18:13:19.333680 IP 178.128.235.233.ssh > cpe688f2e17b093-cm688f2e17b090.cpe.net.cable.rogers.com.55367: Flags [P.], seq 1446380:1446584, ack 865, win 501, length 204
18:13:19.333819 IP 178.128.235.233.ssh > cpe688f2e17b093-cm688f2e17b090.cpe.net.cable.rogers.com.55367: Flags [P.], seq 1446584:1446788, ack 865, win 501, length 204
18:13:19.333991 IP 178.128.235.233.ssh > cpe688f2e17b093-cm688f2e17b090.cpe.net.cable.rogers.com.55367: Flags [P.], seq 1446788:1446992, ack 865, win 501, length 204
18:13:19.334134 IP 178.128.235.233.ssh > cpe688f2e17b093-cm688f2e17b090.cpe.net.cable.rogers.com.55367: Flags [P.], seq 1446992:1447196, ack 865, win 501, length 204
18:13:19.334249 IP 178.128.235.233.ssh > cpe688f2e17b093-cm688f2e17b090.cpe.net.cable.rogers.com.55367: Flags [P.], seq 1447196:1447400, ack 865, win 501, length 204
18:13:19.334355 IP 178.128.235.233.ssh > cpe688f2e17b093-cm688f2e17b090.cpe.net.cable.rogers.com.55367: Flags [P.], seq 1447400:1447604, ack 865, win 501, length 204
18:13:19.334451 IP 178.128.235.233.ssh > cpe688f2e17b093-cm688f2e17b090.cpe.net.cable.rogers.com.55367: Flags [P.], seq 1447604:1447808, ack 865, win 501, length 204
18:13:19.334490 IP cpe688f2e17b093-cm688f2e17b090.cpe.net.cable.rogers.com.55367 > 178.128.235.233.ssh: Flags [.], ack 1416224, win 1029, length 0
18:13:19.334505 IP cpe688f2e17b093-cm688f2e17b090.cpe.net.cable.rogers.com.55367 > 178.128.235.233.ssh: Flags [.], ack 1416836, win 1026, length 0
18:13:19.334510 IP cpe688f2e17b093-cm688f2e17b090.cpe.net.cable.rogers.com.55367 > 178.128.235.233.ssh: Flags [.], ack 1417244, win 1025, length 0
18:13:19.334514 IP cpe688f2e17b093-cm688f2e17b090.cpe.net.cable.rogers.com.55367 > 178.128.235.233.ssh: Flags [.], ack 1417652, win 1029, length 0
18:13:19.334518 IP cpe688f2e17b093-cm688f2e17b090.cpe.net.cable.rogers.com.55367 > 178.128.235.233.ssh: Flags [.], ack 1418060, win 1027, length 0
18:13:19.334529 IP cpe688f2e17b093-cm688f2e17b090.cpe.net.cable.rogers.com.55367 > 178.128.235.233.ssh: Flags [.], ack 1418264, win 1026, length 0
18:13:19.334533 IP cpe688f2e17b093-cm688f2e17b090.cpe.net.cable.rogers.com.55367 > 178.128.235.233.ssh: Flags [.], ack 1418672, win 1025, length 0
18:13:19.334537 IP cpe688f2e17b093-cm688f2e17b090.cpe.net.cable.rogers.com.55367 > 178.128.235.233.ssh: Flags [.], ack 1419284, win 1029, length 0
18:13:19.334541 IP cpe688f2e17b093-cm688f2e17b090.cpe.net.cable.rogers.com.55367 > 178.128.235.233.ssh: Flags [.], ack 1419896, win 1026, length 0
18:13:19.334545 IP cpe688f2e17b093-cm688f2e17b090.cpe.net.cable.rogers.com.55367 > 178.128.235.233.ssh: Flags [.], ack 1423020, win 1029, length 0
18:13:19.334550 IP cpe688f2e17b093-cm688f2e17b090.cpe.net.cable.rogers.com.55367 > 178.128.235.233.ssh: Flags [.], ack 1424856, win 1029, length 0
18:13:19.334555 IP cpe688f2e17b093-cm688f2e17b090.cpe.net.cable.rogers.com.55367 > 178.128.235.233.ssh: Flags [.], ack 1425468, win 1026, length 0
18:13:19.334559 IP cpe688f2e17b093-cm688f2e17b090.cpe.net.cable.rogers.com.55367 > 178.128.235.233.ssh: Flags [.], ack 1425876, win 1025, length 0
18:13:19.334564 IP cpe688f2e17b093-cm688f2e17b090.cpe.net.cable.rogers.com.55367 > 178.128.235.233.ssh: Flags [P.], seq 865:901, ack 1425876, win 1025, length 36
18:13:19.334571 IP cpe688f2e17b093-cm688f2e17b090.cpe.net.cable.rogers.com.55367 > 178.128.235.233.ssh: Flags [.], ack 1426284, win 1029, length 0
18:13:19.334576 IP cpe688f2e17b093-cm688f2e17b090.cpe.net.cable.rogers.com.55367 > 178.128.235.233.ssh: Flags [.], ack 1426692, win 1027, length 0
18:13:19.334580 IP cpe688f2e17b093-cm688f2e17b090.cpe.net.cable.rogers.com.55367 > 178.128.235.233.ssh: Flags [.], ack 1427304, win 1025, length 0
18:13:19.334586 IP cpe688f2e17b093-cm688f2e17b090.cpe.net.cable.rogers.com.55367 > 178.128.235.233.ssh: Flags [.], ack 1427916, win 1029, length 0
18:13:19.334590 IP cpe688f2e17b093-cm688f2e17b090.cpe.net.cable.rogers.com.55367 > 178.128.235.233.ssh: Flags [.], ack 1428324, win 1027, length 0
18:13:19.334593 IP cpe688f2e17b093-cm688f2e17b090.cpe.net.cable.rogers.com.55367 > 178.128.235.233.ssh: Flags [.], ack 1428732, win 1025, length 0
^C
7794 packets captured
7821 packets received by filter
5 packets dropped by kernel
root@lamp-ubuntu-s-1vcpu-1gb-tor1-01:~#
