root@lamp-ubuntu-s-1vcpu-1gb-tor1-01:~# tcpdump -c 5 -i eth0
tcpdump: verbose output suppressed, use -v or -vv for full protocol decode
listening on eth0, link-type EN10MB (Ethernet), capture size 262144 bytes
18:06:23.936275 IP 178.128.235.233.ssh > cpe688f2e17b093-cm688f2e17b090.cpe.net.cable.rogers.com.55367: Flags [P.], seq 501772454:501772562, ack 444523193, win 501, length 108
18:06:23.936436 IP 178.128.235.233.ssh > cpe688f2e17b093-cm688f2e17b090.cpe.net.cable.rogers.com.55367: Flags [P.], seq 108:144, ack 1, win 501, length 36
18:06:23.936498 IP 178.128.235.233.ssh > cpe688f2e17b093-cm688f2e17b090.cpe.net.cable.rogers.com.55367: Flags [P.], seq 144:252, ack 1, win 501, length 108
18:06:23.936594 IP 178.128.235.233.ssh > cpe688f2e17b093-cm688f2e17b090.cpe.net.cable.rogers.com.55367: Flags [P.], seq 252:288, ack 1, win 501, length 36
18:06:23.937346 IP 178.128.235.233.33249 > dns.google.domain: 48419+ PTR? 213.164.230.99.in-addr.arpa. (45)
5 packets captured
21 packets received by filter
0 packets dropped by kernel
root@lamp-ubuntu-s-1vcpu-1gb-tor1-01:~#
