root@lamp-ubuntu-s-1vcpu-1gb-tor1-01:~# tcpdump -i eth0
18:02:05.004904 IP cpe688f2e17b093-cm688f2e17b090.cpe.net.cable.rogers.com.55367 > 178.128.235.233.ssh: Flags [.], ack 273876, win 1025, length 0
18:02:05.004913 IP cpe688f2e17b093-cm688f2e17b090.cpe.net.cable.rogers.com.55367 > 178.128.235.233.ssh: Flags [.], ack 274080, win 1024, length 0
18:02:05.004918 IP cpe688f2e17b093-cm688f2e17b090.cpe.net.cable.rogers.com.55367 > 178.128.235.233.ssh: Flags [.], ack 274488, win 1029, length 0
18:02:05.004925 IP cpe688f2e17b093-cm688f2e17b090.cpe.net.cable.rogers.com.55367 > 178.128.235.233.ssh: Flags [.], ack 275100, win 1026, length 0
18:02:05.004932 IP cpe688f2e17b093-cm688f2e17b090.cpe.net.cable.rogers.com.55367 > 178.128.235.233.ssh: Flags [.], ack 275304, win 1025, length 0
18:02:05.004938 IP cpe688f2e17b093-cm688f2e17b090.cpe.net.cable.rogers.com.55367 > 178.128.235.233.ssh: Flags [.], ack 275712, win 1024, length 0
18:02:05.004945 IP cpe688f2e17b093-cm688f2e17b090.cpe.net.cable.rogers.com.55367 > 178.128.235.233.ssh: Flags [.], ack 276120, win 1029, length 0
18:02:05.004951 IP cpe688f2e17b093-cm688f2e17b090.cpe.net.cable.rogers.com.55367 > 178.128.235.233.ssh: Flags [.], ack 276528, win 1027, length 0
18:02:05.004957 IP cpe688f2e17b093-cm688f2e17b090.cpe.net.cable.rogers.com.55367 > 178.128.235.233.ssh: Flags [.], ack 278192, win 1029, length 0
18:02:05.004963 IP cpe688f2e17b093-cm688f2e17b090.cpe.net.cable.rogers.com.55367 > 178.128.235.233.ssh: Flags [.], ack 278612, win 1027, length 0
18:02:05.004969 IP cpe688f2e17b093-cm688f2e17b090.cpe.net.cable.rogers.com.55367 > 178.128.235.233.ssh: Flags [.], ack 279020, win 1025, length 0
18:02:05.004974 IP cpe688f2e17b093-cm688f2e17b090.cpe.net.cable.rogers.com.55367 > 178.128.235.233.ssh: Flags [.], ack 279428, win 1024, length 0
18:02:05.004981 IP cpe688f2e17b093-cm688f2e17b090.cpe.net.cable.rogers.com.55367 > 178.128.235.233.ssh: Flags [.], ack 279836, win 1029, length 0
18:02:05.004988 IP cpe688f2e17b093-cm688f2e17b090.cpe.net.cable.rogers.com.55367 > 178.128.235.233.ssh: Flags [.], ack 280244, win 1027, length 0
18:02:05.004993 IP cpe688f2e17b093-cm688f2e17b090.cpe.net.cable.rogers.com.55367 > 178.128.235.233.ssh: Flags [.], ack 280652, win 1025, length 0
18:02:05.004999 IP cpe688f2e17b093-cm688f2e17b090.cpe.net.cable.rogers.com.55367 > 178.128.235.233.ssh: Flags [P.], seq 145:181, ack 280856, win 1025, length 36
18:02:05.005007 IP cpe688f2e17b093-cm688f2e17b090.cpe.net.cable.rogers.com.55367 > 178.128.235.233.ssh: Flags [.], ack 281468, win 1029, length 0
^C
1609 packets captured
1609 packets received by filter
0 packets dropped by kernel
root@lamp-ubuntu-s-1vcpu-1gb-tor1-01:~#
