root@lamp-ubuntu-s-1vcpu-1gb-tor1-01:~# tcpdump -n -i eth0
18:11:20.482568 IP 178.128.235.233.22 > 99.230.164.213.55367: Flags [P.], seq 3085952:3086116, ack 1873, win 501, length 164
18:11:20.483063 IP 178.128.235.233.22 > 99.230.164.213.55367: Flags [P.], seq 3086116:3089248, ack 1873, win 501, length 3132
18:11:20.483187 IP 178.128.235.233.22 > 99.230.164.213.55367: Flags [P.], seq 3089248:3089412, ack 1873, win 501, length 164
18:11:20.483287 IP 178.128.235.233.22 > 99.230.164.213.55367: Flags [P.], seq 3089412:3089576, ack 1873, win 501, length 164
18:11:20.483391 IP 178.128.235.233.22 > 99.230.164.213.55367: Flags [P.], seq 3089576:3089740, ack 1873, win 501, length 164
18:11:20.483557 IP 178.128.235.233.22 > 99.230.164.213.55367: Flags [P.], seq 3089740:3089904, ack 1873, win 501, length 164
18:11:20.483676 IP 178.128.235.233.22 > 99.230.164.213.55367: Flags [P.], seq 3089904:3090068, ack 1873, win 501, length 164
18:11:20.483842 IP 178.128.235.233.22 > 99.230.164.213.55367: Flags [P.], seq 3090068:3090232, ack 1873, win 501, length 164
18:11:20.484007 IP 178.128.235.233.22 > 99.230.164.213.55367: Flags [P.], seq 3090232:3090396, ack 1873, win 501, length 164
18:11:20.484122 IP 178.128.235.233.22 > 99.230.164.213.55367: Flags [P.], seq 3090396:3090560, ack 1873, win 501, length 164
18:11:20.484224 IP 178.128.235.233.22 > 99.230.164.213.55367: Flags [P.], seq 3090560:3090724, ack 1873, win 501, length 164
18:11:20.484324 IP 178.128.235.233.22 > 99.230.164.213.55367: Flags [P.], seq 3090724:3090888, ack 1873, win 501, length 164
18:11:20.484433 IP 178.128.235.233.22 > 99.230.164.213.55367: Flags [P.], seq 3090888:3091052, ack 1873, win 501, length 164
18:11:20.484546 IP 178.128.235.233.22 > 99.230.164.213.55367: Flags [P.], seq 3091052:3091216, ack 1873, win 501, length 164
18:11:20.484660 IP 178.128.235.233.22 > 99.230.164.213.55367: Flags [P.], seq 3091216:3091380, ack 1873, win 501, length 164
18:11:20.484799 IP 178.128.235.233.22 > 99.230.164.213.55367: Flags [P.], seq 3091380:3091544, ack 1873, win 501, length 164
18:11:20.484907 IP 178.128.235.233.22 > 99.230.164.213.55367: Flags [P.], seq 3091544:3091708, ack 1873, win 501, length 164
18:11:20.485007 IP 178.128.235.233.22 > 99.230.164.213.55367: Flags [P.], seq 3091708:3091872, ack 1873, win 501, length 164
18:11:20.485112 IP 178.128.235.233.22 > 99.230.164.213.55367: Flags [P.], seq 3091872:3092036, ack 1873, win 501, length 164
18:11:20.485211 IP 178.128.235.233.22 > 99.230.164.213.55367: Flags [P.], seq 3092036:3092200, ack 1873, win 501, length 164
18:11:20.485394 IP 178.128.235.233.22 > 99.230.164.213.55367: Flags [P.], seq 3092200:3092364, ack 1873, win 501, length 164
18:11:20.485504 IP 178.128.235.233.22 > 99.230.164.213.55367: Flags [P.], seq 3092364:3092528, ack 1873, win 501, length 164
18:11:20.485609 IP 178.128.235.233.22 > 99.230.164.213.55367: Flags [P.], seq 3092528:3092692, ack 1873, win 501, length 164
18:11:20.485708 IP 178.128.235.233.22 > 99.230.164.213.55367: Flags [P.], seq 3092692:3092856, ack 1873, win 501, length 164
18:11:20.485825 IP 178.128.235.233.22 > 99.230.164.213.55367: Flags [P.], seq 3092856:3093020, ack 1873, win 501, length 164
18:11:20.485930 IP 178.128.235.233.22 > 99.230.164.213.55367: Flags [P.], seq 3093020:3093184, ack 1873, win 501, length 164
18:11:20.486059 IP 178.128.235.233.22 > 99.230.164.213.55367: Flags [P.], seq 3093184:3093348, ack 1873, win 501, length 164
18:11:20.486239 IP 178.128.235.233.22 > 99.230.164.213.55367: Flags [P.], seq 3093348:3093512, ack 1873, win 501, length 164
18:11:20.486404 IP 178.128.235.233.22 > 99.230.164.213.55367: Flags [P.], seq 3093512:3093676, ack 1873, win 501, length 164
18:11:20.486523 IP 178.128.235.233.22 > 99.230.164.213.55367: Flags [P.], seq 3093676:3093840, ack 1873, win 501, length 164
18:11:20.486660 IP 178.128.235.233.22 > 99.230.164.213.55367: Flags [P.], seq 3093840:3094004, ack 1873, win 501, length 164
18:11:20.486770 IP 178.128.235.233.22 > 99.230.164.213.55367: Flags [P.], seq 3094004:3094168, ack 1873, win 501, length 164
18:11:20.486868 IP 178.128.235.233.22 > 99.230.164.213.55367: Flags [P.], seq 3094168:3094332, ack 1873, win 501, length 164
18:11:20.486970 IP 178.128.235.233.22 > 99.230.164.213.55367: Flags [P.], seq 3094332:3094496, ack 1873, win 501, length 164
18:11:20.487081 IP 178.128.235.233.22 > 99.230.164.213.55367: Flags [P.], seq 3094496:3094660, ack 1873, win 501, length 164
18:11:20.487216 IP 178.128.235.233.22 > 99.230.164.213.55367: Flags [P.], seq 3094660:3094824, ack 1873, win 501, length 164
18:11:20.487391 IP 178.128.235.233.22 > 99.230.164.213.55367: Flags [P.], seq 3094824:3094988, ack 1873, win 501, length 164
18:11:20.487552 IP 178.128.235.233.22 > 99.230.164.213.55367: Flags [P.], seq 3094988:3095152, ack 1873, win 501, length 164
18:11:20.487686 IP 178.128.235.233.22 > 99.230.164.213.55367: Flags [P.], seq 3095152:3095316, ack 1873, win 501, length 164
18:11:20.487864 IP 178.128.235.233.22 > 99.230.164.213.55367: Flags [P.], seq 3095316:3095480, ack 1873, win 501, length 164
18:11:20.488035 IP 99.230.164.213.55367 > 178.128.235.233.22: Flags [.], ack 3076628, win 1029, length 0
18:11:20.488056 IP 99.230.164.213.55367 > 178.128.235.233.22: Flags [.], ack 3076792, win 1028, length 0
18:11:20.488063 IP 99.230.164.213.55367 > 178.128.235.233.22: Flags [P.], seq 1873:1909, ack 3076792, win 1028, length 36
18:11:20.488068 IP 99.230.164.213.55367 > 178.128.235.233.22: Flags [.], ack 3077284, win 1026, length 0
18:11:20.488085 IP 99.230.164.213.55367 > 178.128.235.233.22: Flags [.], ack 3077776, win 1024, length 0
18:11:20.488092 IP 99.230.164.213.55367 > 178.128.235.233.22: Flags [.], ack 3078104, win 1029, length 0
18:11:20.488095 IP 99.230.164.213.55367 > 178.128.235.233.22: Flags [.], ack 3079064, win 1025, length 0
18:11:20.488110 IP 99.230.164.213.55367 > 178.128.235.233.22: Flags [.], ack 3079392, win 1024, length 0
18:11:20.488115 IP 99.230.164.213.55367 > 178.128.235.233.22: Flags [.], ack 3079556, win 1029, length 0
18:11:20.488120 IP 99.230.164.213.55367 > 178.128.235.233.22: Flags [.], ack 3079884, win 1027, length 0
18:11:20.488124 IP 99.230.164.213.55367 > 178.128.235.233.22: Flags [.], ack 3080212, win 1026, length 0
18:11:20.488127 IP 99.230.164.213.55367 > 178.128.235.233.22: Flags [.], ack 3080540, win 1025, length 0
18:11:20.488130 IP 99.230.164.213.55367 > 178.128.235.233.22: Flags [.], ack 3080868, win 1024, length 0
18:11:20.488133 IP 99.230.164.213.55367 > 178.128.235.233.22: Flags [.], ack 3081196, win 1029, length 0
18:11:20.488137 IP 99.230.164.213.55367 > 178.128.235.233.22: Flags [.], ack 3081524, win 1027, length 0
18:11:20.488140 IP 99.230.164.213.55367 > 178.128.235.233.22: Flags [.], ack 3082016, win 1025, length 0
18:11:20.488143 IP 99.230.164.213.55367 > 178.128.235.233.22: Flags [.], ack 3082344, win 1024, length 0
18:11:20.488146 IP 99.230.164.213.55367 > 178.128.235.233.22: Flags [.], ack 3082672, win 1029, length 0
18:11:20.488148 IP 99.230.164.213.55367 > 178.128.235.233.22: Flags [.], ack 3083000, win 1027, length 0
18:11:20.488151 IP 99.230.164.213.55367 > 178.128.235.233.22: Flags [.], ack 3083492, win 1025, length 0
18:11:20.488154 IP 99.230.164.213.55367 > 178.128.235.233.22: Flags [.], ack 3083820, win 1024, length 0
18:11:20.488156 IP 99.230.164.213.55367 > 178.128.235.233.22: Flags [.], ack 3084148, win 1029, length 0
18:11:20.488159 IP 99.230.164.213.55367 > 178.128.235.233.22: Flags [.], ack 3084640, win 1027, length 0
18:11:20.488162 IP 99.230.164.213.55367 > 178.128.235.233.22: Flags [.], ack 3085132, win 1025, length 0
18:11:20.488165 IP 99.230.164.213.55367 > 178.128.235.233.22: Flags [.], ack 3085460, win 1024, length 0
^C
21247 packets captured
21307 packets received by filter
59 packets dropped by kernel
root@lamp-ubuntu-s-1vcpu-1gb-tor1-01:~#
